{
  "schemaVersion": "0.1",
  "name": "InventoryPanelSample",
  "category": "UI",
  "description": "Small AI-editable sample blueprint for UI panels.",
  "variables": [
    {
      "id": "var_8c3aa38d6fd44d51a894294e2c65bb74",
      "name": "left",
      "type": "float",
      "defaultValue": 1,
      "scope": "runtime",
      "description": "Variable of type Float"
    },
    {
      "id": "var_0583e8ccccd048b39aca8670ff7152d7",
      "name": "p2",
      "type": "float",
      "defaultValue": 1,
      "scope": "runtime",
      "description": "Variable of type Float"
    },
    {
      "id": "var_fb028b26ff0b4f44bee4c0bfd9c32795",
      "name": "New Variable",
      "type": "Test.InventoryItem",
      "defaultValue": {
        "count": 32,
        "id": "1",
        "position": [
          0,
          0
        ],
        "rarity": "Common"
      },
      "scope": "runtime",
      "description": "Variable of type TestInventoryItemData"
    },
    {
      "id": "var_8f808d5b82fb48cf96c8aa87ed7d5da3",
      "name": "falsd",
      "type": "bool",
      "defaultValue": false,
      "scope": "runtime",
      "description": "Variable of type Boolean"
    },
    {
      "id": "var_d584c1f738854e1991d67b757337673a",
      "name": "InventoryItemCatalog",
      "type": "Blueprint",
      "defaultValue": "Assets/Game/Blueprints/Inventory/Data/InventoryItemCatalog.blueprint.json",
      "scope": "runtime"
    },
    {
      "id": "var_51883aa2ea7e45f085a310942682b026",
      "name": "InventoryPanel_sample",
      "type": "Blueprint",
      "defaultValue": "Assets/BlueprintSystem/Samples/InventoryPanel.sample.blueprint.json",
      "scope": "runtime"
    }
  ],
  "bindings": [
    {
      "name": "TitleText",
      "type": "TMP_Text",
      "required": true
    },
    {
      "name": "CloseButton",
      "type": "Button",
      "required": true
    },
    {
      "name": "Text_TMP",
      "type": "TMP_Text",
      "required": true
    },
    {
      "name": "Button",
      "type": "Button",
      "required": true
    },
    {
      "name": "Text_TMP2",
      "type": "TMP_Text",
      "required": true
    },
    {
      "name": "Image",
      "type": "Image",
      "required": true
    },
    {
      "name": "c1b7e0eb0a0b72d11e39a31306f08d97",
      "type": "Sprite",
      "required": true
    }
  ],
  "components": [],
  "nodes": [
    {
      "id": "get_inventory_item_catalog",
      "typeId": "Variable.Get",
      "position": [
        147.56,
        302.3662
      ],
      "properties": {
        "name": "InventoryItemCatalog"
      }
    },
    {
      "id": "blueprint_setvariable",
      "typeId": "Blueprint.SetVariable",
      "position": [
        389.98,
        139.655
      ],
      "properties": {
        "target": "Assets/Game/Blueprints/Inventory/Data/InventoryItemCatalog.blueprint.json",
        "name": ""
      }
    },
    {
      "id": "set_inventory_item_catalog",
      "typeId": "Variable.Set",
      "position": [
        416,
        385.5
      ],
      "properties": {
        "name": "InventoryItemCatalog",
        "value": "Assets/Game/Blueprints/Inventory/Data/InventoryItemCatalog.blueprint.json"
      }
    },
    {
      "id": "get_inventory_panel_sample",
      "typeId": "Variable.Get",
      "position": [
        264.1588,
        558.62
      ],
      "properties": {
        "name": "InventoryPanel_sample"
      }
    }
  ],
  "edges": []
}