{
  "schemaVersion": "0.1",
  "name": "EquipmentStatusPresenter",
  "category": "Equipment/UI/Presenter",
  "description": "Refreshes equipment status text.",
  "variables": [
    {
      "id": "var_equipment_data_blueprint",
      "name": "equipment_data_blueprint",
      "type": "Blueprint",
      "defaultValue": "Assets/Game/Blueprint/Equipment/Data/EquipmentData.blueprint.json",
      "scope": "runtime",
      "exposed": false,
      "persistent": false,
      "description": "Target Assets/Game/Blueprint/Equipment/Data/EquipmentData.blueprint.json"
    }
  ],
  "bindings": [
    {
      "name": "equipment_status_text",
      "type": "TMP_Text",
      "required": true
    }
  ],
  "components": [],
  "nodes": [
    {
      "id": "get_data_0",
      "typeId": "Variable.Get",
      "position": [
        0,
        0
      ],
      "properties": {
        "name": "equipment_data_blueprint"
      }
    },
    {
      "id": "event_refresh_1",
      "typeId": "Game.Event.Custom",
      "position": [
        0,
        0
      ],
      "properties": {
        "eventName": "RefreshRequested"
      }
    },
    {
      "id": "get_status_2",
      "typeId": "Blueprint.GetVariable",
      "position": [
        0,
        0
      ],
      "properties": {
        "target": "",
        "name": "status_message"
      }
    },
    {
      "id": "set_status_3",
      "typeId": "UI.SetText",
      "position": [
        0,
        0
      ],
      "properties": {
        "target": "equipment_status_text"
      }
    }
  ],
  "edges": [
    {
      "from": "get_data_0.value",
      "to": "get_status_2.target"
    },
    {
      "from": "event_refresh_1.execOut",
      "to": "set_status_3.execIn"
    },
    {
      "from": "get_status_2.value",
      "to": "set_status_3.value"
    }
  ]
}
