{
  "schemaVersion": "0.1",
  "name": "EquipmentSelectionBehavior",
  "category": "Equipment/Behavior",
  "description": "Refreshes equipment selection state after a slot request.",
  "variables": [
    {
      "id": "var_equipment_data_blueprint",
      "name": "equipment_data_blueprint",
      "type": "Blueprint",
      "defaultValue": "Assets/Game/Blueprint/Equipment/Data/EquipmentData.blueprint.json",
      "scope": "runtime",
      "exposed": false,
      "persistent": false,
      "description": "Target Assets/Game/Blueprint/Equipment/Data/EquipmentData.blueprint.json"
    },
    {
      "id": "var_equipment_slots_presenter_blueprint",
      "name": "equipment_slots_presenter_blueprint",
      "type": "Blueprint",
      "defaultValue": "Assets/Game/Blueprint/Equipment/UI/Presenters/EquipmentSlotsPresenter.blueprint.json",
      "scope": "runtime",
      "exposed": false,
      "persistent": false,
      "description": "Target Assets/Game/Blueprint/Equipment/UI/Presenters/EquipmentSlotsPresenter.blueprint.json"
    },
    {
      "id": "var_equipment_stats_presenter_blueprint",
      "name": "equipment_stats_presenter_blueprint",
      "type": "Blueprint",
      "defaultValue": "Assets/Game/Blueprint/Equipment/UI/Presenters/EquipmentStatsPresenter.blueprint.json",
      "scope": "runtime",
      "exposed": false,
      "persistent": false,
      "description": "Target Assets/Game/Blueprint/Equipment/UI/Presenters/EquipmentStatsPresenter.blueprint.json"
    },
    {
      "id": "var_equipment_detail_presenter_blueprint",
      "name": "equipment_detail_presenter_blueprint",
      "type": "Blueprint",
      "defaultValue": "Assets/Game/Blueprint/Equipment/UI/Presenters/EquipmentDetailPresenter.blueprint.json",
      "scope": "runtime",
      "exposed": false,
      "persistent": false,
      "description": "Target Assets/Game/Blueprint/Equipment/UI/Presenters/EquipmentDetailPresenter.blueprint.json"
    },
    {
      "id": "var_equipment_status_presenter_blueprint",
      "name": "equipment_status_presenter_blueprint",
      "type": "Blueprint",
      "defaultValue": "Assets/Game/Blueprint/Equipment/UI/Presenters/EquipmentStatusPresenter.blueprint.json",
      "scope": "runtime",
      "exposed": false,
      "persistent": false,
      "description": "Target Assets/Game/Blueprint/Equipment/UI/Presenters/EquipmentStatusPresenter.blueprint.json"
    },
    {
      "id": "var_equipment_stat_recalc_blueprint",
      "name": "equipment_stat_recalc_blueprint",
      "type": "Blueprint",
      "defaultValue": "Assets/Game/Blueprint/Equipment/Behavior/EquipmentStatRecalcBehavior.blueprint.json",
      "scope": "runtime",
      "exposed": false,
      "persistent": false,
      "description": "Target Assets/Game/Blueprint/Equipment/Behavior/EquipmentStatRecalcBehavior.blueprint.json"
    }
  ],
  "bindings": [],
  "components": [],
  "nodes": [
    {
      "id": "get_data_0",
      "typeId": "Variable.Get",
      "position": [
        0,
        0
      ],
      "properties": {
        "name": "equipment_data_blueprint"
      }
    },
    {
      "id": "event_select_1",
      "typeId": "Game.Event.Custom",
      "position": [
        0,
        0
      ],
      "properties": {
        "eventName": "SelectSlotRequested"
      }
    },
    {
      "id": "select_status_2",
      "typeId": "Blueprint.SetVariable",
      "position": [
        0,
        0
      ],
      "properties": {
        "target": "",
        "name": "status_message",
        "value": "Equipment slot selected."
      }
    },
    {
      "id": "select_refresh_get_eq_slots_3",
      "typeId": "Variable.Get",
      "position": [
        0,
        0
      ],
      "properties": {
        "name": "equipment_slots_presenter_blueprint"
      }
    },
    {
      "id": "select_refresh_trig_eq_slots_4",
      "typeId": "Blueprint.TriggerEvent",
      "position": [
        0,
        0
      ],
      "properties": {
        "target": "",
        "eventName": "RefreshRequested"
      }
    },
    {
      "id": "select_refresh_get_eq_detail_5",
      "typeId": "Variable.Get",
      "position": [
        0,
        0
      ],
      "properties": {
        "name": "equipment_detail_presenter_blueprint"
      }
    },
    {
      "id": "select_refresh_trig_eq_detail_6",
      "typeId": "Blueprint.TriggerEvent",
      "position": [
        0,
        0
      ],
      "properties": {
        "target": "",
        "eventName": "RefreshRequested"
      }
    },
    {
      "id": "select_refresh_get_eq_status_7",
      "typeId": "Variable.Get",
      "position": [
        0,
        0
      ],
      "properties": {
        "name": "equipment_status_presenter_blueprint"
      }
    },
    {
      "id": "select_refresh_trig_eq_status_8",
      "typeId": "Blueprint.TriggerEvent",
      "position": [
        0,
        0
      ],
      "properties": {
        "target": "",
        "eventName": "RefreshRequested"
      }
    }
  ],
  "edges": [
    {
      "from": "get_data_0.value",
      "to": "select_status_2.target"
    },
    {
      "from": "event_select_1.execOut",
      "to": "select_status_2.execIn"
    },
    {
      "from": "select_refresh_get_eq_slots_3.value",
      "to": "select_refresh_trig_eq_slots_4.target"
    },
    {
      "from": "select_refresh_get_eq_detail_5.value",
      "to": "select_refresh_trig_eq_detail_6.target"
    },
    {
      "from": "select_refresh_get_eq_status_7.value",
      "to": "select_refresh_trig_eq_status_8.target"
    },
    {
      "from": "select_status_2.execOut",
      "to": "select_refresh_trig_eq_slots_4.execIn"
    },
    {
      "from": "select_refresh_trig_eq_slots_4.execOut",
      "to": "select_refresh_trig_eq_detail_6.execIn"
    },
    {
      "from": "select_refresh_trig_eq_detail_6.execOut",
      "to": "select_refresh_trig_eq_status_8.execIn"
    }
  ]
}
